scene_id,event_id,crime_type,suspect,victim,object,location,action,timestamp,notes
153,2,homicide,Ronald King,John Turner,rifle,backyard,witnessed,2024-03-20T23:30:00,Ronald King witnessed John Turner with rifle at backyard
153,3,homicide,Ronald King,Amanda Hernandez,pills,backyard,called 911,2024-03-20T23:58:00,Ronald King called 911 Amanda Hernandez with pills at backyard
153,4,homicide,Ronald King,Amanda Hernandez,pills,backyard,called 911,2024-03-21T00:07:00,Ronald King called 911 Amanda Hernandez with pills at backyard
153,5,homicide,John Turner,Amanda Hernandez,sword,bus,saw crime,2024-03-20T23:16:00,Witness: John Turner saw crime
440,1,fraud,Pamela Campbell,Brenda White,documents,hotel room,deceived,2024-06-14T12:14:00,Pamela Campbell deceived Brenda White with documents at hotel room
440,2,fraud,Pamela Campbell,Brenda White,documents,hotel room,contacted victims,2024-06-14T12:23:00,Pamela Campbell contacted victims Brenda White with documents at hotel room
440,3,fraud,Jessica Campbell,Brenda White,bag,hotel room,saw crime,2024-06-14T12:14:00,Witness: Jessica Campbell saw crime
224,1,fraud,Paul Johnson,Linda Phillips,laptop,cafe,filed false claim,2024-01-03T17:41:00,Paul Johnson filed false claim Linda Phillips with laptop at cafe
224,2,fraud,Paul Johnson,Rachel Martinez,laptop,cafe,fled scene,2024-01-03T18:00:00,Paul Johnson fled scene Rachel Martinez with laptop at cafe
224,3,fraud,Paul Johnson,Linda Phillips,laptop,cafe,covered tracks,2024-01-03T18:41:00,Paul Johnson covered tracks Linda Phillips with laptop at cafe
224,4,fraud,Paul Johnson,Rachel Martinez,ring,hotel room,fled scene,2024-01-03T19:05:00,Paul Johnson fled scene Rachel Martinez with ring at hotel room
288,1,fraud,Sandra Torres,Richard Thomas,cigarette,condo,used fake ID,2024-01-23T05:42:00,Sandra Torres used fake ID Richard Thomas with cigarette at condo
288,2,fraud,Sandra Torres,Richard Thomas,tablet,condo,contacted victims,2024-01-23T05:50:00,Sandra Torres contacted victims Richard Thomas with tablet at condo
268,1,burglary,Betty Flores,Michelle Allen,phone,house,climbed in,2024-04-11T15:13:00,Betty Flores climbed in Michelle Allen with phone at house
268,2,burglary,Betty Flores,Michelle Allen,headphones,house,ransacked,2024-04-11T15:30:00,Betty Flores ransacked Michelle Allen with headphones at house
268,3,burglary,Betty Flores,Michelle Allen,headphones,house,covered face,2024-04-11T15:51:00,Betty Flores covered face Michelle Allen with headphones at house
268,4,burglary,Betty Flores,Michelle Allen,headphones,house,wore gloves,2024-04-11T15:55:00,Betty Flores wore gloves Michelle Allen with headphones at house
53,1,kidnapping,Nicole Gomez,Thomas Carter,revolver,abandoned building,abducted,2024-02-13T04:25:00,Nicole Gomez abducted Thomas Carter with revolver at abandoned building
53,2,kidnapping,Nicole Gomez,Thomas Carter,revolver,abandoned building,demanded ransom,2024-02-13T04:46:00,Nicole Gomez demanded ransom Thomas Carter with revolver at abandoned building
319,1,arson,Jack Torres,Robert Flores,lighter,storage unit,burned,2024-01-28T10:34:00,Jack Torres burned Robert Flores with lighter at storage unit
319,2,arson,Jack Torres,Jeffrey Gomez,lighter,storage unit,intervened,2024-01-28T10:39:00,Jack Torres intervened Jeffrey Gomez with lighter at storage unit
319,3,arson,Jack Torres,Robert Flores,cash,storage unit,fled,2024-01-28T11:24:00,Jack Torres fled Robert Flores with cash at storage unit
201,1,homicide,Michael Wright,Jacob Thomas,knife,bus,strangled,2024-03-15T09:32:00,Michael Wright strangled Jacob Thomas with knife at bus
201,2,homicide,Michael Wright,Donald Anderson,coins,bus,called police,2024-03-15T09:39:00,Michael Wright called police Donald Anderson with coins at bus
201,3,homicide,Michael Wright,Robert Phillips,coins,rural road,fled scene,2024-03-15T10:32:00,Michael Wright fled scene Robert Phillips with coins at rural road
201,4,homicide,Robert Phillips,Jacob Thomas,gun,bus,heard commotion,2024-03-15T09:32:00,Witness: Robert Phillips heard commotion
354,1,robbery,Kevin Flores,Jack Wright,laptop,truck,stole,2024-04-01T15:15:00,Kevin Flores stole Jack Wright with laptop at truck
354,2,robbery,Kevin Flores,Samantha White,laptop,truck,called police,2024-04-01T15:29:00,Kevin Flores called police Samantha White with laptop at truck
354,3,robbery,Kevin Flores,Jack Wright,laptop,truck,changed clothes,2024-04-01T15:33:00,Kevin Flores changed clothes Jack Wright with laptop at truck
354,4,robbery,Kevin Flores,Jack Wright,dagger,train station,counted money,2024-04-01T15:39:00,Kevin Flores counted money Jack Wright with dagger at train station
104,1,fraud,Paul Johnson,Betty Perez,gloves,office,impersonated,2024-01-16T07:28:00,Paul Johnson impersonated Betty Perez with gloves at office
104,2,fraud,Paul Johnson,Betty Perez,gloves,office,contacted victims,2024-01-16T07:36:00,Paul Johnson contacted victims Betty Perez with gloves at office
104,3,fraud,Paul Johnson,Betty Perez,gloves,office,contacted victims,2024-01-16T07:52:00,Paul Johnson contacted victims Betty Perez with gloves at office
104,4,fraud,Paul Johnson,Betty Perez,gloves,garage,fled country,2024-01-16T07:46:00,Paul Johnson fled country Betty Perez with gloves at garage
381,1,kidnapping,Daniel Jackson,Kathleen Johnson,rifle,car,grabbed,2024-12-05T22:54:00,Daniel Jackson grabbed Kathleen Johnson with rifle at car
381,2,kidnapping,Daniel Jackson,Kathleen Johnson,mask,car,isolated victim,2024-12-05T23:22:00,Daniel Jackson isolated victim Kathleen Johnson with mask at car
381,3,kidnapping,Daniel Jackson,Kathleen Johnson,mask,car,held captive,2024-12-05T23:08:00,Daniel Jackson held captive Kathleen Johnson with mask at car
455,1,arson,George Baker,Ronald Ramirez,documents,loading dock,started blaze,2024-03-23T18:03:00,George Baker started blaze Ronald Ramirez with documents at loading dock
455,2,arson,George Baker,Ronald Ramirez,documents,basement,fled,2024-03-23T18:07:00,George Baker fled Ronald Ramirez with documents at basement
455,3,arson,George Baker,Ronald Ramirez,documents,backyard,blocked exits,2024-03-23T18:51:00,George Baker blocked exits Ronald Ramirez with documents at backyard
41,1,homicide,Kathleen Anderson,Christopher Garcia,machete,taxi,murdered,2024-06-26T10:51:00,Kathleen Anderson murdered Christopher Garcia with machete at taxi
41,2,homicide,Kathleen Anderson,Christopher Garcia,revolver,taxi,cleaned scene,2024-06-26T11:13:00,Kathleen Anderson cleaned scene Christopher Garcia with revolver at taxi
41,3,homicide,Kathleen Anderson,Christopher Garcia,vial,taxi,checked pulse,2024-06-26T11:43:00,Kathleen Anderson checked pulse Christopher Garcia with vial at taxi
41,4,homicide,Kathleen Anderson,Christopher Garcia,vial,apartment,covered tracks,2024-06-26T11:00:00,Kathleen Anderson covered tracks Christopher Garcia with vial at apartment
41,5,homicide,Kathleen Anderson,Christopher Garcia,bottle,alleyway,covered tracks,2024-06-26T12:31:00,Kathleen Anderson covered tracks Christopher Garcia with bottle at alleyway
41,6,homicide,John Turner,Christopher Garcia,documents,taxi,walked past,2024-06-26T10:51:00,Red herring event
48,1,fraud,Deborah Perez,Jason Rivera,cup,forest,deceived,2024-10-01T17:07:00,Deborah Perez deceived Jason Rivera with cup at forest
48,2,fraud,Deborah Perez,Deborah Rodriguez,debit card,forest,fled scene,2024-10-01T17:08:00,Deborah Perez fled scene Deborah Rodriguez with debit card at forest
48,3,fraud,Deborah Perez,Jason Rivera,documents,forest,covered tracks,2024-10-01T18:03:00,Deborah Perez covered tracks Jason Rivera with documents at forest
48,4,fraud,Deborah Rodriguez,Jason Rivera,coins,forest,saw crime,2024-10-01T17:07:00,Witness: Deborah Rodriguez saw crime
317,1,kidnapping,Lisa Nguyen,Michelle Allen,bag,nightclub,captured,2024-05-04T18:11:00,Lisa Nguyen captured Michelle Allen with bag at nightclub
317,2,kidnapping,Lisa Nguyen,Michelle Allen,syringe,bank,negotiated,2024-05-04T18:35:00,Lisa Nguyen negotiated Michelle Allen with syringe at bank
317,3,kidnapping,Lisa Nguyen,Michelle Allen,rifle,street corner,held captive,2024-05-04T19:09:00,Lisa Nguyen held captive Michelle Allen with rifle at street corner
317,4,kidnapping,Ryan Miller,Michelle Allen,bag,nightclub,was present,2024-05-04T18:11:00,Witness: Ryan Miller was present
60,1,burglary,Anthony Young,Jeffrey Gomez,gloves,apartment,bypassed security,2024-12-24T05:30:00,Anthony Young bypassed security Jeffrey Gomez with gloves at apartment
60,2,burglary,Anthony Young,Jeffrey Gomez,crowbar,apartment,wore gloves,2024-12-24T05:42:00,Anthony Young wore gloves Jeffrey Gomez with crowbar at apartment
60,3,burglary,Anthony Young,Jeffrey Gomez,crowbar,living room,turned off alarm,2024-12-24T06:20:00,Anthony Young turned off alarm Jeffrey Gomez with crowbar at living room
60,4,burglary,Frank White,Jeffrey Gomez,cup,apartment,talked to,2024-12-24T05:30:00,Red herring event
289,1,homicide,Jacob Thomas,Jessica Hernandez,scissors,home,poisoned,2024-11-13T22:22:00,Jacob Thomas poisoned Jessica Hernandez with scissors at home
289,2,homicide,Jacob Thomas,Jessica Hernandez,scissors,house,fled,2024-11-13T22:39:00,Jacob Thomas fled Jessica Hernandez with scissors at house
289,3,homicide,Jacob Thomas,Jessica Hernandez,pills,house,fled,2024-11-13T23:18:00,Jacob Thomas fled Jessica Hernandez with pills at house
289,4,homicide,Jonathan Torres,Jessica Hernandez,screwdriver,home,arrived later,2024-11-13T22:22:00,Witness: Jonathan Torres arrived later
17,1,homicide,Alexander Robinson,Jacob Torres,rock,warehouse,shot,2024-10-06T19:41:00,Alexander Robinson shot Jacob Torres with rock at warehouse
17,2,homicide,Alexander Robinson,Jacob Torres,rock,warehouse,disposed evidence,2024-10-06T20:01:00,Alexander Robinson disposed evidence Jacob Torres with rock at warehouse
94,1,domestic_violence,Catherine Thomas,Scott Davis,knife,condo,cornered,2024-03-23T23:54:00,Catherine Thomas cornered Scott Davis with knife at condo
94,2,domestic_violence,Catherine Thomas,Scott Davis,knife,condo,children witnessed,2024-03-23T23:59:00,Catherine Thomas children witnessed Scott Davis with knife at condo
94,3,domestic_violence,Catherine Thomas,Scott Davis,car keys,townhouse,blocked door,2024-03-24T00:10:00,Catherine Thomas blocked door Scott Davis with car keys at townhouse
94,4,domestic_violence,Catherine Thomas,Scott Davis,car keys,store,promised to change,2024-03-24T00:33:00,Catherine Thomas promised to change Scott Davis with car keys at store
97,1,homicide,Anthony Young,Rachel Evans,dagger,basement,killed,2024-04-02T20:33:00,Anthony Young killed Rachel Evans with dagger at basement
97,2,homicide,Anthony Young,Paul Johnson,dagger,basement,called police,2024-04-02T20:56:00,Anthony Young called police Paul Johnson with dagger at basement
97,3,homicide,Anthony Young,Paul Johnson,dagger,home,witnessed,2024-04-02T20:41:00,Anthony Young witnessed Paul Johnson with dagger at home
485,1,kidnapping,Jacob Green,Benjamin Hernandez,bag,playground,tied up,2024-08-19T22:51:00,Jacob Green tied up Benjamin Hernandez with bag at playground
485,2,kidnapping,Jacob Green,Sharon King,bag,playground,intervened,2024-08-19T22:56:00,Jacob Green intervened Sharon King with bag at playground
485,3,kidnapping,Jacob Green,Sharon King,toolbox,playground,called police,2024-08-19T22:57:00,Jacob Green called police Sharon King with toolbox at playground
485,4,kidnapping,Sharon King,Benjamin Hernandez,flashlight,playground,arrived later,2024-08-19T22:51:00,Witness: Sharon King arrived later
399,1,arson,Kimberly Campbell,Deborah Rodriguez,gloves,van,used accelerant,2024-09-10T16:24:00,Kimberly Campbell used accelerant Deborah Rodriguez with gloves at van
394,1,robbery,Dorothy Smith,Anthony Young,machete,van,demanded,2024-03-21T19:46:00,Dorothy Smith demanded Anthony Young with machete at van
394,2,robbery,Dorothy Smith,Anthony Young,machete,van,drove away,2024-03-21T20:00:00,Dorothy Smith drove away Anthony Young with machete at van
394,3,robbery,Dorothy Smith,Anthony Young,machete,van,hid loot,2024-03-21T20:40:00,Dorothy Smith hid loot Anthony Young with machete at van
273,1,homicide,Thomas Carter,Kevin Flores,tape,rural road,suffocated,2024-03-17T17:36:00,Thomas Carter suffocated Kevin Flores with tape at rural road
273,2,homicide,Thomas Carter,Anna Parker,pills,rural road,helped victim,2024-03-17T18:04:00,Thomas Carter helped victim Anna Parker with pills at rural road
87,1,arson,Jessica Wilson,Carol Torres,backpack,factory,ignited,2024-01-09T17:23:00,Jessica Wilson ignited Carol Torres with backpack at factory
87,2,arson,Jessica Wilson,Carol Torres,gloves,factory,called fire department,2024-01-09T17:53:00,Jessica Wilson called fire department Carol Torres with gloves at factory
87,3,arson,Jessica Wilson,Carol Torres,gloves,factory,blocked exits,2024-01-09T17:43:00,Jessica Wilson blocked exits Carol Torres with gloves at factory
87,4,arson,Larry Johnson,Carol Torres,car keys,factory,walked past,2024-01-09T17:23:00,Red herring event
30,1,domestic_violence,Patricia Martin,Sharon Nguyen,ring,garage,cornered,2024-01-11T04:22:00,Patricia Martin cornered Sharon Nguyen with ring at garage
30,2,domestic_violence,Patricia Martin,Sharon Nguyen,ring,garage,left house,2024-01-11T04:23:00,Patricia Martin left house Sharon Nguyen with ring at garage
30,3,domestic_violence,Patricia Martin,Ryan Miller,ring,garage,called police,2024-01-11T04:48:00,Patricia Martin called police Ryan Miller with ring at garage
30,4,domestic_violence,Ryan Miller,Sharon Nguyen,bottle,garage,saw crime,2024-01-11T04:22:00,Witness: Ryan Miller saw crime
144,1,fraud,Mary Davis,Kathleen Gonzalez,camera,restaurant,created fake documents,2024-08-09T07:01:00,Mary Davis created fake documents Kathleen Gonzalez with camera at restaurant
144,2,fraud,Mary Davis,Kathleen Gonzalez,camera,restaurant,destroyed records,2024-08-09T07:27:00,Mary Davis destroyed records Kathleen Gonzalez with camera at restaurant
144,3,fraud,Mary Davis,Kathleen Gonzalez,coins,restaurant,destroyed records,2024-08-09T07:09:00,Mary Davis destroyed records Kathleen Gonzalez with coins at restaurant
144,4,fraud,Mary Davis,Kathleen Gonzalez,scissors,restaurant,destroyed records,2024-08-09T08:25:00,Mary Davis destroyed records Kathleen Gonzalez with scissors at restaurant
292,1,burglary,Joseph Gonzalez,Emma Sanchez,smartwatch,mall,bypassed security,2024-07-02T04:48:00,Joseph Gonzalez bypassed security Emma Sanchez with smartwatch at mall
292,2,burglary,Joseph Gonzalez,John Clark,smartwatch,nightclub,called police,2024-07-02T05:14:00,Joseph Gonzalez called police John Clark with smartwatch at nightclub
47,1,arson,Mark Walker,Ryan Nguyen,mask,hotel room,lit match,2024-08-15T11:30:00,Mark Walker lit match Ryan Nguyen with mask at hotel room
47,2,arson,Mark Walker,Ryan Nguyen,mask,hotel room,blocked exits,2024-08-15T11:49:00,Mark Walker blocked exits Ryan Nguyen with mask at hotel room
47,3,arson,Mark Walker,Ryan Nguyen,mask,home,blocked exits,2024-08-15T12:26:00,Mark Walker blocked exits Ryan Nguyen with mask at home
483,1,assault,Joseph Gonzalez,Ronald King,bottle,townhouse,attacked,2024-12-12T15:00:00,Joseph Gonzalez attacked Ronald King with bottle at townhouse
241,1,homicide,Jacob Torres,Jessica Campbell,crowbar,rural road,fatally wounded,2024-05-04T20:50:00,Jacob Torres fatally wounded Jessica Campbell with crowbar at rural road
241,2,homicide,Jacob Torres,Jessica Campbell,bat,taxi,fled,2024-05-04T20:53:00,Jacob Torres fled Jessica Campbell with bat at taxi
241,3,homicide,Jacob Torres,Jessica Campbell,scissors,garage,left scene,2024-05-04T21:44:00,Jacob Torres left scene Jessica Campbell with scissors at garage
241,4,homicide,Jacob Torres,Jessica Campbell,scissors,condo,checked pulse,2024-05-04T21:17:00,Jacob Torres checked pulse Jessica Campbell with scissors at condo
241,5,homicide,Jacob Torres,Jessica Campbell,razor,condo,checked pulse,2024-05-04T22:06:00,Jacob Torres checked pulse Jessica Campbell with razor at condo
321,1,homicide,Laura Walker,Deborah Rodriguez,knife,bedroom,stabbed,2024-09-08T00:07:00,Laura Walker stabbed Deborah Rodriguez with knife at bedroom
321,2,homicide,Laura Walker,Deborah Rodriguez,knife,rural road,attempted to revive,2024-09-08T00:16:00,Laura Walker attempted to revive Deborah Rodriguez with knife at rural road
321,3,homicide,Laura Walker,Deborah Rodriguez,knife,rural road,panicked,2024-09-08T00:29:00,Laura Walker panicked Deborah Rodriguez with knife at rural road
321,4,homicide,Laura Walker,Deborah Rodriguez,knife,bus,fled,2024-09-08T01:34:00,Laura Walker fled Deborah Rodriguez with knife at bus
321,5,homicide,Emma Sanchez,Deborah Rodriguez,jewelry,bedroom,heard commotion,2024-09-08T00:07:00,Witness: Emma Sanchez heard commotion
233,1,homicide,Daniel Jackson,Gregory Ramirez,gun,rural road,bludgeoned,2024-10-21T23:12:00,Daniel Jackson bludgeoned Gregory Ramirez with gun at rural road
233,2,homicide,Daniel Jackson,Gregory Ramirez,gun,rural road,covered tracks,2024-10-21T23:28:00,Daniel Jackson covered tracks Gregory Ramirez with gun at rural road
233,3,homicide,Daniel Jackson,Gregory Ramirez,gun,rural road,disposed evidence,2024-10-21T23:28:00,Daniel Jackson disposed evidence Gregory Ramirez with gun at rural road
397,1,kidnapping,Patrick Lewis,Janet Lewis,vial,nightclub,grabbed,2024-08-27T07:59:00,Patrick Lewis grabbed Janet Lewis with vial at nightclub
397,2,kidnapping,Patrick Lewis,Janet Lewis,gun,nightclub,drove away,2024-08-27T08:00:00,Patrick Lewis drove away Janet Lewis with gun at nightclub
397,3,kidnapping,Patrick Lewis,Gregory Ramirez,pistol,nightclub,helped victim,2024-08-27T08:13:00,Patrick Lewis helped victim Gregory Ramirez with pistol at nightclub
397,4,kidnapping,Gregory Ramirez,Janet Lewis,wire,nightclub,arrived later,2024-08-27T07:59:00,Witness: Gregory Ramirez arrived later
198,1,domestic_violence,Michael Wright,Scott Davis,documents,backyard,threw object at,2024-07-14T13:52:00,Michael Wright threw object at Scott Davis with documents at backyard
171,1,assault,Jacob Thomas,John Turner,lighter,park,beat,2024-08-05T07:54:00,Jacob Thomas beat John Turner with lighter at park
171,2,assault,Jacob Thomas,John Turner,lighter,bedroom,apologized,2024-08-05T08:09:00,Jacob Thomas apologized John Turner with lighter at bedroom
171,3,assault,Jacob Thomas,John Turner,lighter,apartment,was subdued,2024-08-05T08:12:00,Jacob Thomas was subdued John Turner with lighter at apartment
171,4,assault,Helen Johnson,John Turner,pen,park,was present,2024-08-05T07:54:00,Witness: Helen Johnson was present
214,1,domestic_violence,Donald Lopez,Kathleen Anderson,machete,home,slapped,2024-07-16T10:56:00,Donald Lopez slapped Kathleen Anderson with machete at home
214,2,domestic_violence,Donald Lopez,Kathleen Anderson,glass,home,apologized,2024-07-16T11:10:00,Donald Lopez apologized Kathleen Anderson with glass at home
214,3,domestic_violence,George Baker,Kathleen Anderson,club,home,saw crime,2024-07-16T10:56:00,Witness: George Baker saw crime
324,1,burglary,Kevin Flores,Jacob Torres,camera,store,pried open,2024-01-19T05:31:00,Kevin Flores pried open Jacob Torres with camera at store
324,2,burglary,Kevin Flores,Jacob Torres,checkbook,store,covered face,2024-01-19T05:36:00,Kevin Flores covered face Jacob Torres with checkbook at store
324,3,burglary,Kevin Flores,Jacob Torres,backpack,store,escaped,2024-01-19T05:57:00,Kevin Flores escaped Jacob Torres with backpack at store
324,4,burglary,Ryan Walker,Jacob Torres,bracelet,store,saw crime,2024-01-19T05:31:00,Witness: Ryan Walker saw crime
145,1,homicide,Pamela Williams,Janet Lewis,brick,house,fatally wounded,2024-03-04T03:56:00,Pamela Williams fatally wounded Janet Lewis with brick at house
145,2,homicide,Pamela Williams,Janet Lewis,brick,apartment,covered tracks,2024-03-04T04:04:00,Pamela Williams covered tracks Janet Lewis with brick at apartment
145,3,homicide,Pamela Williams,Janet Lewis,brick,apartment,hid body,2024-03-04T04:46:00,Pamela Williams hid body Janet Lewis with brick at apartment
145,4,homicide,Pamela Williams,Janet Lewis,brick,apartment,left scene,2024-03-04T04:50:00,Pamela Williams left scene Janet Lewis with brick at apartment
145,5,homicide,Pamela Williams,Janet Lewis,brick,forest,hid body,2024-03-04T04:20:00,Pamela Williams hid body Janet Lewis with brick at forest
183,1,arson,Patrick Gonzalez,Mark Walker,car keys,train station,torched,2024-12-02T12:52:00,Patrick Gonzalez torched Mark Walker with car keys at train station
183,2,arson,Patrick Gonzalez,Mark Walker,car keys,train station,called fire department,2024-12-02T12:59:00,Patrick Gonzalez called fire department Mark Walker with car keys at train station
183,3,arson,John Turner,Mark Walker,bottle,train station,was nearby,2024-12-02T12:52:00,Red herring event
15,1,arson,Nicole Martin,Thomas Ramirez,gloves,cafe,started blaze,2024-04-26T05:56:00,Nicole Martin started blaze Thomas Ramirez with gloves at cafe
15,2,arson,Nicole Martin,Thomas Ramirez,gloves,cafe,called fire department,2024-04-26T06:07:00,Nicole Martin called fire department Thomas Ramirez with gloves at cafe
263,1,arson,Robert Phillips,Angela Wilson,glass,hotel room,started blaze,2024-07-23T17:30:00,Robert Phillips started blaze Angela Wilson with glass at hotel room
263,2,arson,Robert Phillips,Angela Wilson,glass,hotel room,fled,2024-07-23T17:49:00,Robert Phillips fled Angela Wilson with glass at hotel room
263,3,arson,Robert Phillips,Angela Wilson,car keys,hotel room,watched from distance,2024-07-23T17:54:00,Robert Phillips watched from distance Angela Wilson with car keys at hotel room
283,1,assault,Christopher Martin,Rachel Martinez,pen,street corner,grabbed,2024-04-16T05:36:00,Christopher Martin grabbed Rachel Martinez with pen at street corner
283,2,assault,Christopher Martin,Ashley Jones,pen,street corner,intervened,2024-04-16T05:47:00,Christopher Martin intervened Ashley Jones with pen at street corner
283,3,assault,Christopher Martin,Rachel Martinez,pen,street corner,fled,2024-04-16T06:34:00,Christopher Martin fled Rachel Martinez with pen at street corner
283,4,assault,Christopher Martin,Ronald Ramirez,pen,bus,fled scene,2024-04-16T05:39:00,Christopher Martin fled scene Ronald Ramirez with pen at bus
283,5,assault,Ronald Ramirez,Rachel Martinez,watch,street corner,was present,2024-04-16T05:36:00,Witness: Ronald Ramirez was present
93,1,kidnapping,Rachel Smith,Kevin Flores,bottle,car,tied up,2024-09-16T08:19:00,Rachel Smith tied up Kevin Flores with bottle at car
93,2,kidnapping,Rachel Smith,Kevin Flores,bottle,car,held captive,2024-09-16T08:32:00,Rachel Smith held captive Kevin Flores with bottle at car
93,3,kidnapping,Rachel Smith,Kevin Flores,tape,car,drove away,2024-09-16T08:41:00,Rachel Smith drove away Kevin Flores with tape at car
320,1,fraud,Carolyn Allen,Justin Wilson,mask,home,scammed,2024-07-16T21:36:00,Carolyn Allen scammed Justin Wilson with mask at home
320,2,fraud,Carolyn Allen,Justin Wilson,mask,home,destroyed records,2024-07-16T21:47:00,Carolyn Allen destroyed records Justin Wilson with mask at home
320,3,fraud,Carolyn Allen,Justin Wilson,mask,office,opened fake accounts,2024-07-16T22:00:00,Carolyn Allen opened fake accounts Justin Wilson with mask at office
320,4,fraud,Betty Ramirez,Justin Wilson,glass,home,was present,2024-07-16T21:36:00,Witness: Betty Ramirez was present
18,1,robbery,Pamela Allen,Frank White,pipe,taxi,threatened,2024-07-18T08:53:00,Pamela Allen threatened Frank White with pipe at taxi
291,1,assault,Angela Williams,Christopher Adams,dagger,construction site,shoved,2024-03-16T23:25:00,Angela Williams shoved Christopher Adams with dagger at construction site
265,1,homicide,Anthony Young,Justin Smith,pills,living room,poisoned,2024-02-23T14:22:00,Anthony Young poisoned Justin Smith with pills at living room
265,2,homicide,Anthony Young,Justin Smith,pills,living room,hid body,2024-02-23T14:52:00,Anthony Young hid body Justin Smith with pills at living room
256,1,fraud,Betty Flores,George Sanchez,headphones,mall,impersonated,2024-06-19T00:26:00,Betty Flores impersonated George Sanchez with headphones at mall
256,2,fraud,Betty Flores,George Sanchez,headphones,home,transferred funds,2024-06-19T00:39:00,Betty Flores transferred funds George Sanchez with headphones at home
256,3,fraud,Betty Flores,George Sanchez,headphones,home,contacted victims,2024-06-19T00:44:00,Betty Flores contacted victims George Sanchez with headphones at home
256,4,fraud,Betty Flores,George Sanchez,headphones,store,opened fake accounts,2024-06-19T01:56:00,Betty Flores opened fake accounts George Sanchez with headphones at store
190,1,domestic_violence,Ashley Jackson,Justin Wilson,pen,living room,pushed,2024-05-19T12:46:00,Ashley Jackson pushed Justin Wilson with pen at living room
190,2,domestic_violence,Ashley Jackson,Justin Wilson,knife,living room,promised to change,2024-05-19T13:14:00,Ashley Jackson promised to change Justin Wilson with knife at living room
137,1,homicide,Susan Turner,Betty Perez,crowbar,abandoned building,killed,2024-06-09T11:36:00,Susan Turner killed Betty Perez with crowbar at abandoned building
137,2,homicide,Susan Turner,Betty Perez,screwdriver,abandoned building,attempted to revive,2024-06-09T11:51:00,Susan Turner attempted to revive Betty Perez with screwdriver at abandoned building
34,1,robbery,Patricia Martin,Frank White,phone,sidewalk,held at knifepoint,2024-11-06T16:35:00,Patricia Martin held at knifepoint Frank White with phone at sidewalk
51,1,assault,Anna Torres,Jacob Thomas,glass,townhouse,tackled,2024-06-23T13:03:00,Anna Torres tackled Jacob Thomas with glass at townhouse
51,2,assault,Emma Sanchez,Jacob Thomas,razor,townhouse,saw crime,2024-06-23T13:03:00,Witness: Emma Sanchez saw crime
36,1,burglary,Jeffrey Gomez,Jeffrey Scott,necklace,cafe,cut fence,2024-04-11T23:40:00,Jeffrey Gomez cut fence Jeffrey Scott with necklace at cafe
36,2,burglary,Jeffrey Gomez,Jeffrey Scott,necklace,cafe,fled,2024-04-11T23:53:00,Jeffrey Gomez fled Jeffrey Scott with necklace at cafe
