scene_id,event_id,crime_type,suspect,victim,object,location,action,timestamp,notes
498,4,robbery,Samantha Gonzalez,Betty Perez,razor,alleyway,called police,2024-11-11T17:50:00,Samantha Gonzalez called police Betty Perez with razor at alleyway
498,5,robbery,Thomas Carter,Pamela Williams,coins,alleyway,arrived later,2024-11-11T16:26:00,Witness: Thomas Carter arrived later
46,1,domestic_violence,Anthony Diaz,Daniel Jackson,wrench,home,destroyed property,2024-10-27T19:51:00,Anthony Diaz destroyed property Daniel Jackson with wrench at home
46,2,domestic_violence,Anthony Diaz,Daniel Jackson,brick,home,apologized,2024-10-27T20:01:00,Anthony Diaz apologized Daniel Jackson with brick at home
77,1,kidnapping,Christopher Nguyen,Nancy Davis,bag,forest,chloroformed,2024-03-24T02:39:00,Christopher Nguyen chloroformed Nancy Davis with bag at forest
77,2,kidnapping,Christopher Nguyen,Nancy Davis,bag,forest,held captive,2024-03-24T03:06:00,Christopher Nguyen held captive Nancy Davis with bag at forest
77,3,kidnapping,Christopher Nguyen,Nancy Davis,bag,forest,drove away,2024-03-24T03:29:00,Christopher Nguyen drove away Nancy Davis with bag at forest
77,4,kidnapping,Christopher Nguyen,Nancy Davis,chain,forest,threatened,2024-03-24T03:03:00,Christopher Nguyen threatened Nancy Davis with chain at forest
77,5,kidnapping,Christopher Nguyen,Nancy Davis,chain,street corner,isolated victim,2024-03-24T04:15:00,Christopher Nguyen isolated victim Nancy Davis with chain at street corner
348,1,burglary,Jacob Martinez,Jessica Campbell,laptop,bar,pried open,2024-03-04T09:40:00,Jacob Martinez pried open Jessica Campbell with laptop at bar
348,2,burglary,Jacob Martinez,Jessica Campbell,camera,bar,searched,2024-03-04T09:58:00,Jacob Martinez searched Jessica Campbell with camera at bar
125,1,kidnapping,Andrew Campbell,Thomas Carter,pen,subway,pulled into van,2024-12-26T18:35:00,Andrew Campbell pulled into van Thomas Carter with pen at subway
125,2,kidnapping,Andrew Campbell,Thomas Carter,bottle,subway,isolated victim,2024-12-26T18:37:00,Andrew Campbell isolated victim Thomas Carter with bottle at subway
125,3,kidnapping,Andrew Campbell,Thomas Carter,bottle,subway,threatened,2024-12-26T18:59:00,Andrew Campbell threatened Thomas Carter with bottle at subway
125,4,kidnapping,Andrew Campbell,Brian Clark,gloves,subway,helped victim,2024-12-26T18:59:00,Andrew Campbell helped victim Brian Clark with gloves at subway
125,5,kidnapping,Andrew Campbell,Brian Clark,gloves,subway,witnessed,2024-12-26T18:51:00,Andrew Campbell witnessed Brian Clark with gloves at subway
172,1,burglary,Donna Robinson,Amy Robinson,rifle,office,pried open,2024-06-25T04:09:00,Donna Robinson pried open Amy Robinson with rifle at office
172,2,burglary,Donna Robinson,Amy Robinson,rifle,office,loaded vehicle,2024-06-25T04:34:00,Donna Robinson loaded vehicle Amy Robinson with rifle at office
172,3,burglary,Donna Robinson,Amy Robinson,rifle,restaurant,loaded vehicle,2024-06-25T05:01:00,Donna Robinson loaded vehicle Amy Robinson with rifle at restaurant
172,4,burglary,Donna Robinson,George Sanchez,rifle,restaurant,witnessed,2024-06-25T04:27:00,Donna Robinson witnessed George Sanchez with rifle at restaurant
172,5,burglary,Anna Torres,Amy Robinson,documents,office,talked to,2024-06-25T04:09:00,Red herring event
304,1,fraud,Brenda White,Eric Martin,camera,hotel room,laundered money,2024-07-27T18:11:00,Brenda White laundered money Eric Martin with camera at hotel room
304,2,fraud,Brenda White,Donna Robinson,camera,hotel room,intervened,2024-07-27T18:32:00,Brenda White intervened Donna Robinson with camera at hotel room
312,1,fraud,Larry Sanchez,Carolyn Lee,coins,townhouse,created fake documents,2024-06-27T07:21:00,Larry Sanchez created fake documents Carolyn Lee with coins at townhouse
312,2,fraud,Larry Sanchez,Carolyn Lee,coins,townhouse,destroyed records,2024-06-27T07:22:00,Larry Sanchez destroyed records Carolyn Lee with coins at townhouse
79,1,arson,Carolyn Clark,Michelle Hernandez,pen,store,ignited,2024-01-06T14:21:00,Carolyn Clark ignited Michelle Hernandez with pen at store
79,2,arson,Carolyn Clark,Janet Lewis,pen,store,helped victim,2024-01-06T14:50:00,Carolyn Clark helped victim Janet Lewis with pen at store
79,3,arson,Carolyn Clark,Daniel Hall,cup,store,intervened,2024-01-06T14:35:00,Carolyn Clark intervened Daniel Hall with cup at store
231,1,arson,Carol Torres,David Gonzalez,scissors,sidewalk,started blaze,2024-08-07T10:34:00,Carol Torres started blaze David Gonzalez with scissors at sidewalk
231,2,arson,Carol Torres,Linda Phillips,scissors,living room,fled scene,2024-08-07T10:45:00,Carol Torres fled scene Linda Phillips with scissors at living room
231,3,arson,Carol Torres,David Gonzalez,backpack,condo,attempted to extinguish,2024-08-07T11:12:00,Carol Torres attempted to extinguish David Gonzalez with backpack at condo
231,4,arson,Anthony Young,David Gonzalez,gloves,sidewalk,arrived later,2024-08-07T10:34:00,Witness: Anthony Young arrived later
363,1,assault,Andrew Campbell,Scott Davis,crowbar,nightclub,beat,2024-05-17T21:47:00,Andrew Campbell beat Scott Davis with crowbar at nightclub
363,2,assault,Andrew Campbell,Rachel Smith,flashlight,nightclub,witnessed,2024-05-17T22:04:00,Andrew Campbell witnessed Rachel Smith with flashlight at nightclub
363,3,assault,Andrew Campbell,Ashley Jackson,cigarette,nightclub,intervened,2024-05-17T22:01:00,Andrew Campbell intervened Ashley Jackson with cigarette at nightclub
363,4,assault,Rachel Smith,Scott Davis,brick,nightclub,saw crime,2024-05-17T21:47:00,Witness: Rachel Smith saw crime
439,1,arson,Katherine Nelson,Pamela Campbell,flashlight,condo,lit match,2024-06-28T16:36:00,Katherine Nelson lit match Pamela Campbell with flashlight at condo
439,2,arson,Katherine Nelson,Pamela Campbell,flashlight,hotel room,watched from distance,2024-06-28T16:45:00,Katherine Nelson watched from distance Pamela Campbell with flashlight at hotel room
439,3,arson,Katherine Nelson,Nancy Davis,pen,nightclub,called police,2024-06-28T16:46:00,Katherine Nelson called police Nancy Davis with pen at nightclub
439,4,arson,Brenda White,Pamela Campbell,glass,condo,was nearby,2024-06-28T16:36:00,Red herring event
277,1,kidnapping,Christine Wilson,Debra Torres,wire,empty lot,grabbed,2024-03-02T05:18:00,Christine Wilson grabbed Debra Torres with wire at empty lot
277,2,kidnapping,Christine Wilson,Debra Torres,wire,empty lot,moved to location,2024-03-02T05:46:00,Christine Wilson moved to location Debra Torres with wire at empty lot
277,3,kidnapping,Christine Wilson,Debra Torres,wire,truck,demanded ransom,2024-03-02T05:40:00,Christine Wilson demanded ransom Debra Torres with wire at truck
277,4,kidnapping,Christine Wilson,Angela Williams,backpack,truck,fled scene,2024-03-02T06:42:00,Christine Wilson fled scene Angela Williams with backpack at truck
277,5,kidnapping,Anna Lee,Debra Torres,dagger,empty lot,saw crime,2024-03-02T05:18:00,Witness: Anna Lee saw crime
495,1,arson,Jacob Clark,Anthony Hill,pen,house,lit match,2024-09-21T06:31:00,Jacob Clark lit match Anthony Hill with pen at house
495,2,arson,Jacob Clark,Christopher Nguyen,pen,house,called police,2024-09-21T06:56:00,Jacob Clark called police Christopher Nguyen with pen at house
495,3,arson,Christopher Nguyen,Anthony Hill,backpack,house,was present,2024-09-21T06:31:00,Witness: Christopher Nguyen was present
308,1,burglary,Patrick Lewis,Rachel Smith,flashlight,house,bypassed security,2024-10-06T19:12:00,Patrick Lewis bypassed security Rachel Smith with flashlight at house
308,2,burglary,Patrick Lewis,Rachel Smith,flashlight,house,fled,2024-10-06T19:24:00,Patrick Lewis fled Rachel Smith with flashlight at house
33,1,homicide,Nicole Clark,Catherine Thomas,revolver,empty lot,executed,2024-08-17T00:58:00,Nicole Clark executed Catherine Thomas with revolver at empty lot
33,2,homicide,Nicole Clark,Catherine Thomas,revolver,rural road,attempted to revive,2024-08-17T01:03:00,Nicole Clark attempted to revive Catherine Thomas with revolver at rural road
33,3,homicide,Nicole Clark,Catherine Thomas,revolver,rural road,called 911,2024-08-17T01:34:00,Nicole Clark called 911 Catherine Thomas with revolver at rural road
33,4,homicide,Nicole Clark,Catherine Thomas,revolver,car,checked pulse,2024-08-17T01:52:00,Nicole Clark checked pulse Catherine Thomas with revolver at car
460,1,burglary,Deborah Rodriguez,Brian Moore,camera,bedroom,broke down door,2024-01-23T00:11:00,Deborah Rodriguez broke down door Brian Moore with camera at bedroom
460,2,burglary,Deborah Rodriguez,Laura Campbell,camera,bedroom,helped victim,2024-01-23T00:39:00,Deborah Rodriguez helped victim Laura Campbell with camera at bedroom
460,3,burglary,Deborah Rodriguez,Laura Campbell,earrings,bedroom,intervened,2024-01-23T00:23:00,Deborah Rodriguez intervened Laura Campbell with earrings at bedroom
460,4,burglary,Deborah Rodriguez,Brian Moore,pistol,living room,wore gloves,2024-01-23T01:08:00,Deborah Rodriguez wore gloves Brian Moore with pistol at living room
460,5,burglary,Deborah Rodriguez,Brian Moore,pistol,living room,wore gloves,2024-01-23T01:59:00,Deborah Rodriguez wore gloves Brian Moore with pistol at living room
433,1,homicide,Laura Campbell,Joshua Green,credit card,abandoned building,stabbed,2024-11-22T05:02:00,Laura Campbell stabbed Joshua Green with credit card at abandoned building
433,2,homicide,Laura Campbell,John Clark,credit card,abandoned building,helped victim,2024-11-22T05:32:00,Laura Campbell helped victim John Clark with credit card at abandoned building
433,3,homicide,Laura Campbell,Joshua Green,handgun,abandoned building,checked pulse,2024-11-22T05:56:00,Laura Campbell checked pulse Joshua Green with handgun at abandoned building
433,4,homicide,Robert Wright,Joshua Green,debit card,abandoned building,heard commotion,2024-11-22T05:02:00,Witness: Robert Wright heard commotion
95,1,arson,Nancy Hernandez,Linda Mitchell,bag,storage unit,set fire,2024-10-03T01:17:00,Nancy Hernandez set fire Linda Mitchell with bag at storage unit
95,2,arson,Nancy Hernandez,Betty Ramirez,bag,storage unit,helped victim,2024-10-03T01:19:00,Nancy Hernandez helped victim Betty Ramirez with bag at storage unit
95,3,arson,Nancy Hernandez,Betty Ramirez,bag,storage unit,called police,2024-10-03T01:55:00,Nancy Hernandez called police Betty Ramirez with bag at storage unit
95,4,arson,Richard Thomas,Linda Mitchell,car keys,storage unit,was nearby,2024-10-03T01:17:00,Red herring event
278,1,domestic_violence,Jacob Martin,Ronald King,flashlight,apartment,pushed,2024-06-04T09:46:00,Jacob Martin pushed Ronald King with flashlight at apartment
278,2,domestic_violence,Jacob Martin,Ronald King,flashlight,apartment,victim called police,2024-06-04T09:49:00,Jacob Martin victim called police Ronald King with flashlight at apartment
278,3,domestic_violence,Jacob Martin,Ronald King,flashlight,apartment,apologized,2024-06-04T10:46:00,Jacob Martin apologized Ronald King with flashlight at apartment
278,4,domestic_violence,Jacob Martin,Ronald King,flashlight,apartment,apologized,2024-06-04T11:10:00,Jacob Martin apologized Ronald King with flashlight at apartment
418,1,robbery,Patricia King,Steven Nguyen,ring,train station,burglarized,2024-06-18T09:14:00,Patricia King burglarized Steven Nguyen with ring at train station
250,1,robbery,Kathleen Williams,Angela Campbell,phone,construction site,mugged,2024-04-22T16:46:00,Kathleen Williams mugged Angela Campbell with phone at construction site
250,2,robbery,Thomas Carter,Angela Campbell,brick,construction site,heard commotion,2024-04-22T16:46:00,Witness: Thomas Carter heard commotion
284,1,burglary,Steven Nguyen,William Hernandez,headphones,mall,broke down door,2024-03-20T03:00:00,Steven Nguyen broke down door William Hernandez with headphones at mall
284,2,burglary,Steven Nguyen,Scott Davis,jewelry,store,called police,2024-03-20T03:12:00,Steven Nguyen called police Scott Davis with jewelry at store
284,3,burglary,Steven Nguyen,Scott Davis,wallet,shop,witnessed,2024-03-20T03:58:00,Steven Nguyen witnessed Scott Davis with wallet at shop
116,1,burglary,Samantha Gonzalez,Amy Robinson,bag,storage unit,kicked door,2024-12-02T22:21:00,Samantha Gonzalez kicked door Amy Robinson with bag at storage unit
116,2,burglary,Samantha Gonzalez,Janet Lewis,bag,nightclub,witnessed,2024-12-02T22:43:00,Samantha Gonzalez witnessed Janet Lewis with bag at nightclub
116,3,burglary,Samantha Gonzalez,Amy Robinson,bag,nightclub,covered face,2024-12-02T22:31:00,Samantha Gonzalez covered face Amy Robinson with bag at nightclub
116,4,burglary,Samantha Gonzalez,Janet Lewis,bag,backyard,helped victim,2024-12-02T22:39:00,Samantha Gonzalez helped victim Janet Lewis with bag at backyard
120,1,fraud,Amanda Hernandez,Daniel Phillips,bat,office,created fake documents,2024-09-15T14:02:00,Amanda Hernandez created fake documents Daniel Phillips with bat at office
120,2,fraud,Amanda Hernandez,Joshua Jones,bat,house,called police,2024-09-15T14:10:00,Amanda Hernandez called police Joshua Jones with bat at house
120,3,fraud,Amanda Hernandez,Daniel Phillips,bat,house,covered tracks,2024-09-15T14:40:00,Amanda Hernandez covered tracks Daniel Phillips with bat at house
251,1,assault,Susan Turner,Ashley Jackson,bottle,store,beat,2024-11-12T15:35:00,Susan Turner beat Ashley Jackson with bottle at store
202,1,robbery,Brian Clark,Rachel Martinez,powder,cafe,grabbed,2024-09-12T17:51:00,Brian Clark grabbed Rachel Martinez with powder at cafe
202,2,robbery,Brian Clark,Rachel Martinez,powder,cafe,counted money,2024-09-12T18:08:00,Brian Clark counted money Rachel Martinez with powder at cafe
219,1,assault,Elizabeth Wright,Brian Moore,knife,basement,shoved,2024-08-02T02:46:00,Elizabeth Wright shoved Brian Moore with knife at basement
219,2,assault,Elizabeth Wright,Brian Moore,knife,backyard,was subdued,2024-08-02T03:07:00,Elizabeth Wright was subdued Brian Moore with knife at backyard
493,1,kidnapping,Angela Wilson,Ashley Jones,mask,car,seized,2024-07-01T21:33:00,Angela Wilson seized Ashley Jones with mask at car
493,2,kidnapping,Angela Wilson,Ashley Jones,syringe,car,held captive,2024-07-01T21:56:00,Angela Wilson held captive Ashley Jones with syringe at car
493,3,kidnapping,Linda Mitchell,Ashley Jones,pills,car,was present,2024-07-01T21:33:00,Witness: Linda Mitchell was present
484,1,burglary,Nicholas Thomas,Ashley Brown,debit card,shop,forced entry,2024-12-15T13:09:00,Nicholas Thomas forced entry Ashley Brown with debit card at shop
484,2,burglary,Nicholas Thomas,Ashley Brown,debit card,shop,wore gloves,2024-12-15T13:14:00,Nicholas Thomas wore gloves Ashley Brown with debit card at shop
339,1,assault,Shirley Baker,Joseph Taylor,car keys,nightclub,shoved,2024-12-02T20:55:00,Shirley Baker shoved Joseph Taylor with car keys at nightclub
339,2,assault,Shirley Baker,Joseph Taylor,car keys,nightclub,fled,2024-12-02T20:58:00,Shirley Baker fled Joseph Taylor with car keys at nightclub
339,3,assault,Shirley Baker,Joseph Taylor,car keys,bar,stopped,2024-12-02T20:59:00,Shirley Baker stopped Joseph Taylor with car keys at bar
85,1,kidnapping,Anthony Nguyen,Linda Adams,revolver,car,abducted,2024-07-08T12:45:00,Anthony Nguyen abducted Linda Adams with revolver at car
85,2,kidnapping,Anthony Nguyen,Linda Adams,revolver,car,called family,2024-07-08T13:03:00,Anthony Nguyen called family Linda Adams with revolver at car
85,3,kidnapping,Anthony Nguyen,Linda Adams,revolver,car,threatened,2024-07-08T12:55:00,Anthony Nguyen threatened Linda Adams with revolver at car
85,4,kidnapping,Anthony Nguyen,Nicole Clark,vial,car,fled scene,2024-07-08T13:18:00,Anthony Nguyen fled scene Nicole Clark with vial at car
85,5,kidnapping,Anthony Nguyen,Linda Adams,vial,car,threatened,2024-07-08T14:01:00,Anthony Nguyen threatened Linda Adams with vial at car
215,1,arson,Nicholas Thomas,Kimberly Campbell,glass,basement,ignited,2024-10-14T14:33:00,Nicholas Thomas ignited Kimberly Campbell with glass at basement
206,1,domestic_violence,Laura Campbell,Sharon Garcia,sword,forest,grabbed,2024-04-23T22:36:00,Laura Campbell grabbed Sharon Garcia with sword at forest
185,1,homicide,Scott Davis,Christine Green,machete,garage,fatally wounded,2024-11-18T05:17:00,Scott Davis fatally wounded Christine Green with machete at garage
185,2,homicide,Scott Davis,Christine Green,bottle,basement,called 911,2024-11-18T05:28:00,Scott Davis called 911 Christine Green with bottle at basement
185,3,homicide,Scott Davis,Carol Ramirez,knife,basement,witnessed,2024-11-18T05:57:00,Scott Davis witnessed Carol Ramirez with knife at basement
185,4,homicide,Scott Davis,Carol Ramirez,dagger,basement,intervened,2024-11-18T06:38:00,Scott Davis intervened Carol Ramirez with dagger at basement
185,5,homicide,Scott Davis,Christine Green,dagger,bus,disposed evidence,2024-11-18T07:13:00,Scott Davis disposed evidence Christine Green with dagger at bus
492,1,burglary,Amanda Hernandez,Kathleen Clark,wrench,apartment,picked lock,2024-06-02T21:38:00,Amanda Hernandez picked lock Kathleen Clark with wrench at apartment
492,2,burglary,Amanda Hernandez,Kathleen Clark,bag,store,turned off alarm,2024-06-02T21:49:00,Amanda Hernandez turned off alarm Kathleen Clark with bag at store
207,1,arson,Ashley Brown,Jacob Taylor,mask,storage unit,set fire,2024-05-18T05:12:00,Ashley Brown set fire Jacob Taylor with mask at storage unit
207,2,arson,Kathleen Johnson,Jacob Taylor,flashlight,storage unit,saw crime,2024-05-18T05:12:00,Witness: Kathleen Johnson saw crime
246,1,domestic_violence,Joseph Taylor,Anthony Young,cigarette,bar,hit,2024-05-28T18:49:00,Joseph Taylor hit Anthony Young with cigarette at bar
246,2,domestic_violence,Joseph Taylor,Anthony Young,cigarette,bar,neighbor heard,2024-05-28T18:50:00,Joseph Taylor neighbor heard Anthony Young with cigarette at bar
246,3,domestic_violence,Joseph Taylor,Melissa Wright,car keys,bar,witnessed,2024-05-28T19:27:00,Joseph Taylor witnessed Melissa Wright with car keys at bar
474,1,robbery,Robert Phillips,George Baker,revolver,store,threatened,2024-03-11T07:57:00,Robert Phillips threatened George Baker with revolver at store
474,2,robbery,Robert Phillips,Barbara Smith,revolver,store,intervened,2024-03-11T08:17:00,Robert Phillips intervened Barbara Smith with revolver at store
474,3,robbery,Robert Phillips,George Baker,bat,store,drove away,2024-03-11T08:43:00,Robert Phillips drove away George Baker with bat at store
35,1,assault,Samantha Rivera,Mary Smith,wrench,store,kneed,2024-08-13T11:19:00,Samantha Rivera kneed Mary Smith with wrench at store
35,2,assault,Samantha Rivera,Mary Smith,wrench,store,victim fought back,2024-08-13T11:26:00,Samantha Rivera victim fought back Mary Smith with wrench at store
425,1,homicide,Jacob Torres,Michael Davis,handgun,bedroom,drowned,2024-05-15T02:07:00,Jacob Torres drowned Michael Davis with handgun at bedroom
425,2,homicide,Jacob Torres,Michael Davis,vial,bedroom,panicked,2024-05-15T02:30:00,Jacob Torres panicked Michael Davis with vial at bedroom
425,3,homicide,Jacob Torres,Michael Davis,vial,bedroom,left scene,2024-05-15T02:41:00,Jacob Torres left scene Michael Davis with vial at bedroom
73,1,homicide,Andrew Campbell,Thomas Carter,razor,hotel room,killed,2024-03-27T04:35:00,Andrew Campbell killed Thomas Carter with razor at hotel room
73,2,homicide,Andrew Campbell,Thomas Carter,razor,hotel room,called 911,2024-03-27T04:50:00,Andrew Campbell called 911 Thomas Carter with razor at hotel room
73,3,homicide,Andrew Campbell,Thomas Carter,razor,hotel room,fled,2024-03-27T05:33:00,Andrew Campbell fled Thomas Carter with razor at hotel room
73,4,homicide,Andrew Campbell,Thomas Carter,razor,van,fled,2024-03-27T05:53:00,Andrew Campbell fled Thomas Carter with razor at van
73,5,homicide,Andrew Campbell,Thomas Carter,vial,van,disposed evidence,2024-03-27T05:51:00,Andrew Campbell disposed evidence Thomas Carter with vial at van
2,1,robbery,Angela Campbell,Betty Flores,bat,truck,mugged,2024-01-15T16:59:00,Angela Campbell mugged Betty Flores with bat at truck
2,2,robbery,Angela Campbell,Betty Flores,revolver,truck,ran away,2024-01-15T17:15:00,Angela Campbell ran away Betty Flores with revolver at truck
385,1,homicide,Deborah Rodriguez,Michelle Allen,watch,alleyway,drowned,2024-06-27T03:26:00,Deborah Rodriguez drowned Michelle Allen with watch at alleyway
385,2,homicide,Deborah Rodriguez,Mark Walker,bottle,house,witnessed,2024-06-27T03:43:00,Deborah Rodriguez witnessed Mark Walker with bottle at house
385,3,homicide,Deborah Rodriguez,Michelle Allen,bottle,house,hid body,2024-06-27T04:18:00,Deborah Rodriguez hid body Michelle Allen with bottle at house
385,4,homicide,David Gonzalez,Michelle Allen,scissors,alleyway,saw crime,2024-06-27T03:26:00,Witness: David Gonzalez saw crime
385,5,homicide,Michelle Taylor,Michelle Allen,bottle,alleyway,talked to,2024-06-27T03:26:00,Red herring event
470,1,domestic_violence,Jacob Martin,Sharon King,sword,apartment,slapped,2024-02-09T05:48:00,Jacob Martin slapped Sharon King with sword at apartment
470,2,domestic_violence,Jacob Martin,Sharon King,sword,apartment,left house,2024-02-09T05:54:00,Jacob Martin left house Sharon King with sword at apartment
64,1,fraud,Margaret Rodriguez,Joshua Turner,tablet,shop,used fake ID,2024-07-12T20:55:00,Margaret Rodriguez used fake ID Joshua Turner with tablet at shop
64,2,fraud,Margaret Rodriguez,Joshua Turner,tablet,shop,opened fake accounts,2024-07-12T21:18:00,Margaret Rodriguez opened fake accounts Joshua Turner with tablet at shop
64,3,fraud,Margaret Rodriguez,Joshua Turner,tablet,shop,covered tracks,2024-07-12T20:59:00,Margaret Rodriguez covered tracks Joshua Turner with tablet at shop
237,1,kidnapping,Pamela Williams,Rachel Martinez,flashlight,empty lot,tied up,2024-01-02T18:25:00,Pamela Williams tied up Rachel Martinez with flashlight at empty lot
237,2,kidnapping,Pamela Williams,Rachel Martinez,syringe,empty lot,moved to location,2024-01-02T18:55:00,Pamela Williams moved to location Rachel Martinez with syringe at empty lot
237,3,kidnapping,Pamela Williams,Rachel Martinez,syringe,empty lot,held captive,2024-01-02T18:49:00,Pamela Williams held captive Rachel Martinez with syringe at empty lot
237,4,kidnapping,George Adams,Rachel Martinez,shotgun,empty lot,was present,2024-01-02T18:25:00,Witness: George Adams was present
358,1,domestic_violence,Robert Flores,Kathleen King,hammer,apartment,threw object at,2024-11-25T11:01:00,Robert Flores threw object at Kathleen King with hammer at apartment
358,2,domestic_violence,Robert Flores,Kathleen King,cigarette,apartment,left house,2024-11-25T11:29:00,Robert Flores left house Kathleen King with cigarette at apartment
358,3,domestic_violence,Robert Flores,Kathleen King,cigarette,apartment,neighbor heard,2024-11-25T11:23:00,Robert Flores neighbor heard Kathleen King with cigarette at apartment
37,1,kidnapping,Jack Rodriguez,Melissa Wright,bottle,playground,seized,2024-09-28T05:50:00,Jack Rodriguez seized Melissa Wright with bottle at playground
37,2,kidnapping,Jack Rodriguez,Melissa Wright,gun,playground,called family,2024-09-28T06:10:00,Jack Rodriguez called family Melissa Wright with gun at playground
84,1,burglary,Jack Wright,Pamela Campbell,earrings,taxi,climbed in,2024-04-11T11:01:00,Jack Wright climbed in Pamela Campbell with earrings at taxi
84,2,burglary,Jack Wright,Pamela Campbell,phone,taxi,searched,2024-04-11T11:09:00,Jack Wright searched Pamela Campbell with phone at taxi
84,3,burglary,William Jackson,Pamela Campbell,phone,taxi,saw crime,2024-04-11T11:01:00,Witness: William Jackson saw crime
426,1,robbery,Frank White,Katherine Nelson,rifle,hotel room,stole,2024-02-03T14:09:00,Frank White stole Katherine Nelson with rifle at hotel room
426,2,robbery,Frank White,Anthony Diaz,tablet,hotel room,fled scene,2024-02-03T14:21:00,Frank White fled scene Anthony Diaz with tablet at hotel room
426,3,robbery,Anthony Diaz,Katherine Nelson,watch,hotel room,was present,2024-02-03T14:09:00,Witness: Anthony Diaz was present
58,1,robbery,George Sanchez,Angela Wilson,camera,van,looted,2024-08-27T15:20:00,George Sanchez looted Angela Wilson with camera at van
58,2,robbery,George Sanchez,Joseph Taylor,camera,van,helped victim,2024-08-27T15:29:00,George Sanchez helped victim Joseph Taylor with camera at van
58,3,robbery,George Sanchez,Angela Wilson,camera,hotel room,counted money,2024-08-27T16:14:00,George Sanchez counted money Angela Wilson with camera at hotel room
58,4,robbery,George Sanchez,Angela Wilson,camera,hotel room,disappeared,2024-08-27T16:23:00,George Sanchez disappeared Angela Wilson with camera at hotel room
58,5,robbery,Kathleen Clark,Angela Wilson,documents,van,talked to,2024-08-27T15:20:00,Red herring event
500,1,burglary,Barbara Robinson,Kathleen Williams,backpack,home,climbed in,2024-02-19T01:17:00,Barbara Robinson climbed in Kathleen Williams with backpack at home
500,2,burglary,Barbara Robinson,Kathleen Williams,wallet,condo,wore gloves,2024-02-19T01:26:00,Barbara Robinson wore gloves Kathleen Williams with wallet at condo
500,3,burglary,Barbara Robinson,Kathleen Williams,wallet,condo,searched,2024-02-19T01:57:00,Barbara Robinson searched Kathleen Williams with wallet at condo
500,4,burglary,Anthony Nguyen,Kathleen Williams,cigarette,home,talked to,2024-02-19T01:17:00,Red herring event
99,1,assault,William Hernandez,Mark Walker,documents,bedroom,headbutted,2024-06-07T09:35:00,William Hernandez headbutted Mark Walker with documents at bedroom
99,2,assault,William Hernandez,Mark Walker,machete,bus stop,threatened more,2024-06-07T09:39:00,William Hernandez threatened more Mark Walker with machete at bus stop
99,3,assault,William Hernandez,Mark Walker,machete,bus stop,victim fought back,2024-06-07T10:23:00,William Hernandez victim fought back Mark Walker with machete at bus stop
471,1,arson,Laura Walker,Anthony Hill,gloves,construction site,set fire,2024-04-26T22:10:00,Laura Walker set fire Anthony Hill with gloves at construction site
212,1,burglary,Kathleen Clark,Anna Parker,flashlight,basement,bypassed security,2024-12-12T04:53:00,Kathleen Clark bypassed security Anna Parker with flashlight at basement
